{
  "id": "inorganic-analytical-chem",
  "schema_version": 1,
  "title": "Chemistry: Inorganic & Analytical",
  "subtitle": "Elements, compounds & the methods of chemical measurement",
  "period": {
    "start": 1662,
    "end": 1989
  },
  "domain": "physical-sciences",
  "mapCenter": [
    50,
    5
  ],
  "mapZoom": 3,
  "methodology": "METHODOLOGY · Every entry anchors to a landmark study, paper, clinical case or theoretical text. The hint explains the idea in plain language; the note names the primary publication and flags replication status, effect-size revisions and known controversies. Studies and effects carry a replicability badge — 🟢 robust · 🟡 nuanced or reduced · 🔴 failed or severely contested. Map pins mark the institution where the work was carried out.",
  "categories": [
    {
      "id": "theory",
      "label": "Theories & Models",
      "icon": "📐",
      "color": "#1A3A5C",
      "accent": "#2471A3",
      "bg": "#F0F7FF",
      "subtitle": "The frameworks that organise elements, bonding and chemical reactivity",
      "entries": []
    },
    {
      "id": "study",
      "label": "Landmark Studies",
      "icon": "🧪",
      "color": "#4A235A",
      "accent": "#7D3C98",
      "bg": "#FAF5FF",
      "subtitle": "The defining experiments — and exactly what they found",
      "entries": []
    },
    {
      "id": "effect",
      "label": "Effects & Phenomena",
      "icon": "📊",
      "color": "#0B4F2E",
      "accent": "#117A65",
      "bg": "#F0FFF6",
      "subtitle": "Named, replicable patterns in chemical systems",
      "entries": []
    },
    {
      "id": "concept",
      "label": "Key Concepts",
      "icon": "🧩",
      "color": "#2C3E50",
      "accent": "#566573",
      "bg": "#F5F6FA",
      "subtitle": "The building blocks and vocabulary every student must command",
      "entries": []
    },
    {
      "id": "method",
      "label": "Methods & Approaches",
      "icon": "🔬",
      "color": "#5D4037",
      "accent": "#8B5E00",
      "bg": "#FFF8F0",
      "subtitle": "The tools and paradigms that generate the field's evidence",
      "entries": []
    },
    {
      "id": "figure",
      "label": "Pioneers & Theorists",
      "icon": "🥇",
      "color": "#7D6608",
      "accent": "#B7770D",
      "bg": "#FEFDE7",
      "subtitle": "The researchers who shaped the discipline",
      "entries": []
    },
    {
      "id": "debate",
      "label": "Debates & Open Questions",
      "icon": "⚖️",
      "color": "#6E2C00",
      "accent": "#CA6F1E",
      "bg": "#FDF5EC",
      "subtitle": "Live controversies — where the field is actively contesting the evidence",
      "entries": []
    },
    {
      "id": "application",
      "label": "Applications",
      "icon": "🔗",
      "color": "#1A5276",
      "accent": "#2E86C1",
      "bg": "#EBF5FB",
      "subtitle": "Where the science leaves the lab",
      "entries": []
    }
  ],
  "timeline": [
    {
      "id": "study",
      "icon": "🧪",
      "accent": "#7D3C98",
      "label": "Landmark Studies",
      "events": []
    },
    {
      "id": "theory",
      "icon": "📐",
      "accent": "#2471A3",
      "label": "Theories & Models",
      "events": []
    },
    {
      "id": "effect",
      "icon": "📊",
      "accent": "#117A65",
      "label": "Effects & Phenomena",
      "events": []
    },
    {
      "id": "method",
      "icon": "🔬",
      "accent": "#8B5E00",
      "label": "Methods",
      "events": []
    },
    {
      "id": "debate",
      "icon": "⚖️",
      "accent": "#B7770D",
      "label": "Debates & Revisions",
      "events": []
    },
    {
      "id": "application",
      "icon": "🔗",
      "accent": "#2E86C1",
      "label": "Applications",
      "events": []
    }
  ]
}